{
  "aggregate": {
    "all_hard_slo_pass_window_count": 4,
    "best_hard_pass_allocation_uplift_vs_fifo": {
      "equal_window_count": 6,
      "max": 0.019912215,
      "mean": 0.003097516,
      "median": 0.0,
      "min": 0.0,
      "negative_window_count": 0,
      "positive_window_count": 5
    },
    "frontier_action_window_frequency": {
      "native-fifo": 9,
      "native-preemptive-0000": 7,
      "native-preemptive-3600": 6,
      "native-preemptive-7200": 5
    },
    "policies": {
      "native-fifo": {
        "allocation_delta_vs_fifo": {
          "equal_window_count": 12,
          "max": 0.0,
          "mean": 0.0,
          "median": 0.0,
          "min": 0.0,
          "negative_window_count": 0,
          "positive_window_count": 0
        },
        "allocation_rate_mean": {
          "max": 0.979751611,
          "mean": 0.734148493,
          "median": 0.770907176,
          "min": 0.46967497
        },
        "allocation_soft_target_pass_count": 4,
        "deterministic_window_count": 12,
        "hard_slo_pass_count": 11,
        "hard_slo_pass_rate": 0.916666667,
        "hp_p95_jct_regression_vs_fifo": {
          "max": 0.0,
          "mean": 0.0,
          "median": 0.0,
          "min": 0.0
        },
        "spot_eviction_rate_per_run": {
          "max": 0.0,
          "mean": 0.0,
          "median": 0.0,
          "min": 0.0
        },
        "window_count": 12
      },
      "native-preemptive-0000": {
        "allocation_delta_vs_fifo": {
          "equal_window_count": 3,
          "max": 0.123810952,
          "mean": 0.01264982,
          "median": 0.000961098,
          "min": -0.026824828,
          "negative_window_count": 2,
          "positive_window_count": 7
        },
        "allocation_rate_mean": {
          "max": 1.0,
          "mean": 0.746798313,
          "median": 0.77160272,
          "min": 0.46967497
        },
        "allocation_soft_target_pass_count": 4,
        "deterministic_window_count": 12,
        "hard_slo_pass_count": 7,
        "hard_slo_pass_rate": 0.583333333,
        "hp_p95_jct_regression_vs_fifo": {
          "max": 0.435976082,
          "mean": 0.031108943,
          "median": 0.0,
          "min": -0.04021911
        },
        "spot_eviction_rate_per_run": {
          "max": 0.94538835,
          "mean": 0.148687773,
          "median": 0.007936508,
          "min": 0.0
        },
        "window_count": 12
      },
      "native-preemptive-3600": {
        "allocation_delta_vs_fifo": {
          "equal_window_count": 4,
          "max": 0.018041285,
          "mean": 0.003434962,
          "median": 1.0122e-05,
          "min": -0.019743974,
          "negative_window_count": 1,
          "positive_window_count": 7
        },
        "allocation_rate_mean": {
          "max": 0.997792896,
          "mean": 0.737583456,
          "median": 0.77160272,
          "min": 0.46967497
        },
        "allocation_soft_target_pass_count": 4,
        "deterministic_window_count": 12,
        "hard_slo_pass_count": 7,
        "hard_slo_pass_rate": 0.583333333,
        "hp_p95_jct_regression_vs_fifo": {
          "max": 2.082078721,
          "mean": 0.172002163,
          "median": 0.0,
          "min": -0.017721233
        },
        "spot_eviction_rate_per_run": {
          "max": 0.818548387,
          "mean": 0.166674685,
          "median": 0.02739726,
          "min": 0.0
        },
        "window_count": 12
      },
      "native-preemptive-7200": {
        "allocation_delta_vs_fifo": {
          "equal_window_count": 4,
          "max": 0.017404277,
          "mean": 0.002034861,
          "median": 1.7664e-05,
          "min": -0.009425734,
          "negative_window_count": 2,
          "positive_window_count": 6
        },
        "allocation_rate_mean": {
          "max": 0.997155887,
          "mean": 0.736183354,
          "median": 0.77160272,
          "min": 0.46967497
        },
        "allocation_soft_target_pass_count": 4,
        "deterministic_window_count": 12,
        "hard_slo_pass_count": 6,
        "hard_slo_pass_rate": 0.5,
        "hp_p95_jct_regression_vs_fifo": {
          "max": 1.690997755,
          "mean": 0.139866454,
          "median": 0.0,
          "min": -0.012600311
        },
        "spot_eviction_rate_per_run": {
          "max": 0.685314685,
          "mean": 0.135158946,
          "median": 0.020833333,
          "min": 0.0
        },
        "window_count": 12
      }
    },
    "selection_status_counts": {
      "no_eligible_policy": 1,
      "selected": 5,
      "tie_requires_human_approval": 6
    },
    "universal_winner_declared": false,
    "window_count": 12
  },
  "limitations": [
    "This is historical, offline counterfactual evaluation, not online scheduling.",
    "Each selected day uses a fixed 30-day warm-up, so jobs submitted earlier than the warm-up boundary are not reconstructed.",
    "native-preemptive-1800 was excluded by the declared 600-second evaluation-resource gate; this is not an SLO failure result.",
    "A no_eligible_policy result is preserved rather than forcing a recommendation."
  ],
  "receipt_fingerprint": "741eecdf2edc17e612023f107f67470d9d6e37d400ed1dc201c9500e705c9173",
  "schema_version": "schednav.multiwindow-evidence/v1",
  "source_evidence": {
    "experiment_fingerprint": "c438429e390242f2369f060c0ea63380b6aae076892dd28ba9fff5c77a84c240",
    "multiwindow_fingerprint": "7f0a36b849c06356148a1820d2e38bbcd683ccbd94c254f5b9e55e2ca50fb8c4",
    "selection_fingerprint": "a0d6915afd6420b376f0e82f695e6a9f86947cb0b4e2e8ed8092ec89d28413b5"
  },
  "study": {
    "action_space": {
      "excluded_profiles": [
        {
          "action_id": "native-preemptive-1800",
          "reason": "Exceeded the declared 600-second per-batch feasibility gate in both full-origin and fixed-30-day-warm-up multi-window trials. This is an evaluation-resource exclusion, not an SLO result."
        }
      ],
      "fingerprint": "b277ab7de527a07d32a0e39eed2e69ef0accc3d6dd56faf8d6b19546afbdc426",
      "name": "native-multiwindow-v1-bounded-policies",
      "path": "configs/action_spaces/native-multiwindow-v1.json"
    },
    "capacity_gpus": 976,
    "dataset": "Alibaba cluster-trace-v2026-spot-gpu",
    "dataset_commit": "0d0f3f1efdbf1add6a7bcc63676eafbd1eb11f71",
    "eligibility": {
      "min_hp_jobs": 20,
      "min_spot_jobs": 20,
      "origin_aligned_complete_windows_only": true,
      "sample_interval_seconds": 3600,
      "window_size_seconds": 86400
    },
    "eligible_window_count": 112,
    "gpu_models": [
      "GPU-series-2"
    ],
    "repetitions_per_policy_per_window": 2,
    "selected_window_count": 12,
    "selection_method": {
      "name": "pressure-by-spot-share-stratified-medoid",
      "pressure_strata": 3,
      "selected_before_simulation": true,
      "spot_share_strata_per_pressure": 4,
      "tie_breaker": "earliest_window_start"
    },
    "source_hashes": {
      "job_info_sha256": "f921e1932ae13196e204fdb0351d6697a7a0ef2e82e00ae123ed20e873284fb2",
      "node_info_sha256": "35ef4d6288061265f2f9a207ef3df79bb1301cb9c0646a62087449e176781895"
    },
    "warmup_seconds": 2592000
  },
  "windows": [
    {
      "best_hard_pass_allocation_rate": 0.5713521938531848,
      "best_hard_pass_allocation_uplift_vs_fifo": 0.0,
      "date": "2024-04-03",
      "fifo_allocation_rate": 0.5713521938531848,
      "policies": {
        "native-fifo": {
          "allocation_rate_mean": 0.5713521938531848,
          "failed_hard_constraints": [],
          "hard_slo_passed": true,
          "hp_jct_p95_seconds": 114158.5,
          "hp_queue_p95_seconds": 0.0,
          "metrics_fingerprint": "e2c6d41a984025c09832107e0d82d4e94f2647c3893419be3dbd8eb5edad8b8d",
          "spot_eviction_rate_per_run": 0.0,
          "spot_guarantee_success_rate": 1.0,
          "spot_jct_p95_seconds": 68935.2
        },
        "native-preemptive-0000": {
          "allocation_rate_mean": 0.571347640066417,
          "failed_hard_constraints": [
            "allocation-fifo-nondegradation"
          ],
          "hard_slo_passed": false,
          "hp_jct_p95_seconds": 114158.5,
          "hp_queue_p95_seconds": 0.0,
          "metrics_fingerprint": "9e7188c349336107b79d6125b70a2a6290dca062d061638dfbe07fa701f1fd6a",
          "spot_eviction_rate_per_run": 0.0,
          "spot_guarantee_success_rate": 1.0,
          "spot_jct_p95_seconds": 68935.2
        },
        "native-preemptive-3600": {
          "allocation_rate_mean": 0.5713521938531848,
          "failed_hard_constraints": [],
          "hard_slo_passed": true,
          "hp_jct_p95_seconds": 114158.5,
          "hp_queue_p95_seconds": 0.0,
          "metrics_fingerprint": "30f14f9e43932ae65a2e44beb2213eeddcfe16d7f58dfe990e1b87153928c1af",
          "spot_eviction_rate_per_run": 0.0,
          "spot_guarantee_success_rate": 1.0,
          "spot_jct_p95_seconds": 68935.2
        },
        "native-preemptive-7200": {
          "allocation_rate_mean": 0.5713521938531848,
          "failed_hard_constraints": [],
          "hard_slo_passed": true,
          "hp_jct_p95_seconds": 114158.5,
          "hp_queue_p95_seconds": 0.0,
          "metrics_fingerprint": "6d032d9e6a1941748b0ee61724fcfbacad86d1c569c5d183de10830eaae8c140",
          "spot_eviction_rate_per_run": 0.0,
          "spot_guarantee_success_rate": 1.0,
          "spot_jct_p95_seconds": 68935.2
        }
      },
      "population": {
        "HP": 106,
        "Spot": 25
      },
      "ranking": {
        "ranking_fingerprint": "dbb619844ea089f851d94ad782fd4eae55d52993d1d6b49abe6ac79f0c97068c",
        "selected_action_ids": [
          "native-fifo",
          "native-preemptive-3600",
          "native-preemptive-7200"
        ],
        "selection_status": "tie_requires_human_approval"
      },
      "regime_signals": {
        "combined_peak_active_pressure": 0.811475,
        "dominant_arrival_type": "HP",